<!-- quiz.dtd — Definición de Tipo de Documento para el concurso de preguntas -->

<!ELEMENT test (question+)>
<!ELEMENT question (wording,choices)>
<!ELEMENT wording (#PCDATA)>
<!ELEMENT choices (choice+)>
<!ELEMENT choice (#PCDATA)>

<!ATTLIST question id CDATA #REQUIRED>
<!ATTLIST choice correct (yes|no) "no">
